<?xml version="1.0" encoding="UTF-8"?>

<!DOCTYPE extension SYSTEM "http://www.izforge.com/izpack/dtd/extension-description.dtd">

<!--
  Part of the Extension class test case.
-->
<extension>

  <header>
    <name>SampleExtension</name>
    <description>It rulez.</description>
    <url>http://www.izforge.com/izpack/</url>
    <license>MIT</license>
    <author>Julien Ponge &lt;julien@izforge.com&gt;</author>
    <author>Julien Ponge &lt;julien_ponge@yahoo.fr&gt;</author>
  </header>

  <provides>
    <ident>SamplePanel1</ident>
    <what>com.izforge.izpack.panel</what>
    <class>com.izforge.izpack.foo.SamplePanel1</class>
    <jar>SamplePanel1.jar</jar>
    <jar>FooLib.jar</jar>
  </provides>

  <provides>
    <ident>SamplePanel2</ident>
    <what>com.izforge.izpack.panel</what>
    <class>com.izforge.izpack.foo.SamplePanel2</class>
    <jar>SamplePanel2.jar</jar>
    <jar>FooLib.jar</jar>
  </provides>

</extension>
